{
  "schema_version": "schema_v1",
  "harness_type": "reference_relational",
  "seed": 9001,
  "num_trials": 200,
  "input_generator": {
    "kind": "canonical_coin_system",
    "systems": [
      [
        1,
        5,
        10,
        25
      ],
      [
        1,
        2,
        5,
        10,
        20,
        50,
        100
      ],
      [
        1,
        3,
        9,
        27
      ]
    ],
    "amount_range": [
      0,
      500
    ]
  },
  "oracle_checks": [
    "counts_length_matches_denoms",
    "weighted_sum_equals_amount",
    "sum_matches_dp_oracle"
  ],
  "timeout_ms": 2000
}
